{
  "id": "io.github.kevendai.network-ip",
  "name": "Network IP",
  "version": "1.0.0",
  "api_version": 1,
  "min_host_version": "2.0.0",
  "entry": "bin/NetworkIpPlugin.exe",
  "capabilities": ["value_provider"],
  "permissions": ["network"],
  "settings_schema": "settings.schema.json",
  "homepage": "https://github.com/kevendai/Rainmeter_todo-plugin-registry/tree/master/official-plugins/network-ip",
  "default_enabled": false,
  "actions": []
}
