{
  "id": "io.github.kevendai.calendar-to-todo",
  "name": "日程转待办",
  "version": "1.0.1",
  "api_version": 1,
  "min_host_version": "2.0.0",
  "entry": "bin/CalendarToTodoPlugin.exe",
  "capabilities": ["todo_transform"],
  "permissions": [],
  "homepage": "https://github.com/kevendai/Rainmeter_todo-plugin-registry/tree/master/official-plugins/calendar-to-todo",
  "default_enabled": true,
  "actions": []
}
